{
  "dod": {
    "items": [
      {
        "checked": true,
        "text": "1. `Workstream.plan_items()` reads from `self._state[\"plan\"]` (not plan.md).\nReturns a list of PlanItem when items exist; None when empty (preserves\nhand-authored Next in snapshot). No `parse_plan` call in workstream.py.\n(Evidence: grep shows no `parse_plan` call remaining in workstream.py.)"
      },
      {
        "checked": true,
        "text": "2. `Workstream._save_state()` no longer syncs plan.md \u2192 state[\"plan\"].\nCalls `_render_plan()` after saving state; `record_snapshot()` also calls\n`_render_plan()` so `lume snapshot` regenerates both views.\n(Evidence: grep shows no `parse_plan` call in _save_state.)"
      },
      {
        "checked": true,
        "text": "3. `PlanItem.from_entity(entity: dict) -> PlanItem` added to plan.py.\nRound-trips through `to_entity()` without loss. (Evidence: unit test.)"
      },
      {
        "checked": true,
        "text": "4. `render_plan(items, title) -> str` added to plan.py. Produces one\n`- P<n> | ... | sketch` line per item; iter as zero-padded NNN or `-`.\n(Evidence: rendered output round-trips through parse_plan; unit tests.)"
      },
      {
        "checked": true,
        "text": "5. `lume [-w <slug>] plan add \"<sketch>\"`: appends a new plan item with\nthe next P<n> id, default type `execution`, default tag `committed`.\nSaves state, regenerates plan.md. Exits 0; prints the new item id.\n(Evidence: unit tests.)"
      },
      {
        "checked": true,
        "text": "6. `lume [-w <slug>] plan link <plan-id> <iter-id>`: sets the `iter` field\nof the matching plan item. Plan item not found exits 1. Saves state,\nregenerates plan.md. (Evidence: unit tests.)"
      },
      {
        "checked": true,
        "text": "7. No machine field is parsed from plan.md in normal engine operation.\n`parse_plan` remains only in plan.py (definition) + migrate.py (legacy\nconverter) + tests. (Evidence: grep lume/ shows only those locations.)"
      },
      {
        "checked": true,
        "text": "8. All live workstream plan.md files regenerated from state.json plan arrays.\nstate-as-data: via `lume snapshot`. lifecycle (closed): direct render call,\nround-trip verified (P1\u2013P6 ids match). build-lume: no plan items; no plan.md.\n(Evidence: plan.md files updated; lifecycle round-trip printed ok.)"
      },
      {
        "checked": true,
        "text": "9. Full suite green; 17 new tests covering from_entity, render_plan\nround-trip, plan_items-from-state, plan add, plan link. Existing stale test\nupdated to assert plan.md regenerated from state (not plan.md \u2192 state).\n(Evidence: 181 tests, 0 failures.)"
      }
    ],
    "preamble": "Retire plan.md as the authored source. State.json `plan` array becomes the sole\nsource of truth for plan items; plan.md becomes a derived view regenerated by the\nengine. Two new CLI verbs let the operator mutate plan items without hand-editing\nfiles.\n\nCode changes are in `workstream.py`, `plan.py`, and `cli.py` only."
  },
  "handback": "P9 complete. Plan flip done: state.json sole source, plan.md derived view, two\nnew CLI verbs, 181 tests green. Ready for verdict.",
  "id": 11,
  "self_review": "Core flip: `plan_items()` reads `state[\"plan\"]`; `_save_state()` stops syncing\nfrom plan.md and instead calls `_render_plan()` after every save. `record_snapshot()`\nalso calls `_render_plan()` so `lume snapshot` regenerates both views atomically.\n\n`parse_plan` retained in plan.py + migrate.py only \u2014 the migration path is the\nintended legacy reader and is explicitly called out in the module docstring.\n\nThe `plan_items() \u2192 None` when empty was the key correctness subtlety: returning\n`[]` broke `build_snapshot`'s \"preserve hand-authored Next\" contract. The fix\n(return None for empty) preserves all downstream behaviour while still reading\nfrom state rather than disk.\n\n`lume plan add` uses `-t` (already extracted by `_extract_flag`); `plan link`\ntakes positional args. No `-g` flag wired for tag \u2014 the sketch arg is rest[3],\ntype comes from the existing `-t` opt. `plan` subcommand dispatched before the\nworkstream-resolution-dependent block (needs the workstream, so after resolution).\n\n17 new tests; 1 test renamed/rewritten (plan_md_mirrored \u2192 plan_md_regenerated).\n181 total, all green."
}
